{"algorithm":"transition-v1","algorithm_config_version":"0000000000000000","confidence":0.5,"evidence_ids":[],"occurred_at":"2026-01-01T00:00:00Z","privacy_class":"restricted","processed_at":"2026-01-01T00:00:01Z","schema_version":"1","source_digest":"0000000000000000000000000000000000000000000000000000000000000000","status":"provisional","subject_id":"sub_00000000","superseded_by":null,"transition_id":"trn_00000000000000000000000000000000","transition_type":"arrival"}
